{
  "$schema": "https://json-schema.org/draft/2020-12/schema",
  "$id": "rules.schema.json",
  "title": "RulesDef (godot/content/defs/rules.json)",
  "$comment": "R0 B.1: world constants only; everything else lives in 02's files. Canonical: gravity 6.0, ceilings 1500/2000, tick_hz 30, lift_model speed_scaled, path_expansions_per_tick 120 (R0 B.11 A-55; was 2000), sim_budget_profile [1, 2], friendly_fire/debug_commands/profile_enabled false. R0 B.11 A-51 appends the sim constants that were named consts: command_rate_per_s, command_burst (04 s11.3), uplink_margin_m (05 C6), request_ttl_s (05 C10/C17), override_echo_s (05 s3.4), shooter_grace_ticks (03 s6.1), path_heuristic_pct (03 s3.6), cut_ladder (03 s4.3 rungs as data).",
  "type": "object",
  "additionalProperties": false,
  "properties": {
    "_doc": {
      "$ref": "#/$defs/doc"
    },
    "gravity": {
      "type": "number",
      "minimum": 5.0,
      "maximum": 8.0,
      "$comment": "01 s3.1.1 anchor 5.0-8.0; canonical 6.0"
    },
    "ceiling_soft_m": {
      "const": 1500,
      "$comment": "01 hard constraint (Sphere.CEILING_SOFT)"
    },
    "ceiling_hard_m": {
      "const": 2000,
      "$comment": "01 hard constraint (Sphere.CEILING_HARD)"
    },
    "tick_hz": {
      "const": 30,
      "$comment": "01 ADR-07 hard constraint"
    },
    "lift_model": {
      "enum": [
        "speed_scaled",
        "damping_only"
      ]
    },
    "path_expansions_per_tick": {
      "type": "integer",
      "minimum": 30,
      "maximum": 10000,
      "$comment": "03 s3.6 / R0 B.11 A-55: 120 calibrated by S-NAV-1 (TA-20 REPORT s5: ~15 us per expansion in-tick); 01 s7 anchor 2,000 superseded by data; sanity bounds"
    },
    "sim_budget_profile": {
      "type": "array",
      "items": {
        "type": "integer",
        "minimum": 1,
        "maximum": 8,
        "$comment": "03 s4.3 cut ladder rungs 1-8 (rung 8 appended by R0 B.11 A-55)"
      },
      "uniqueItems": true,
      "$comment": "default [1, 2]"
    },
    "friendly_fire": {
      "type": "boolean"
    },
    "debug_commands": {
      "type": "boolean"
    },
    "profile_enabled": {
      "type": "boolean"
    },
    "command_rate_per_s": {
      "type": "integer",
      "minimum": 1,
      "maximum": 100,
      "$comment": "04 s11.3 token bucket: 10 commands/s sustained (sim S10, R0 C2-27); CommandValidator.RATE_PER_S until TA-49"
    },
    "command_burst": {
      "type": "integer",
      "minimum": 1,
      "maximum": 300,
      "$comment": "04 s11.3 burst 30 (CommandValidator.BURST until TA-49)"
    },
    "uplink_margin_m": {
      "type": "number",
      "minimum": 0,
      "maximum": 500,
      "$comment": "05 C6 / C6r: POSSESS refused at altitude >= ceiling_hard_m - uplink_margin_m (= 1,950 m; REJECTED_UPLINK); ControlMachine.UPLINK_MARGIN_M until TA-49"
    },
    "request_ttl_s": {
      "type": "number",
      "minimum": 0,
      "maximum": 120,
      "$comment": "05 s2 request_tick / C10 / C17: a hand-over request expires after 10 s (ControlMachine.REQUEST_TTL_S until TA-49)"
    },
    "override_echo_s": {
      "type": "number",
      "minimum": 0,
      "maximum": 120,
      "$comment": "05 s3.4 / C2: ORDER_FAILED(OVERRIDDEN) echo when the previous human head is younger than 10 s (ControlMachine.ECHO_WINDOW_S until TA-49)"
    },
    "shooter_grace_ticks": {
      "type": "integer",
      "minimum": 0,
      "maximum": 90,
      "$comment": "03 s6.1 step 8: a projectile skips its shooter for 10 ticks after its first collision tick (Collision.shooter_grace_ticks, set by SimWorld until TA-49)"
    },
    "path_heuristic_pct": {
      "type": "integer",
      "minimum": 0,
      "maximum": 100,
      "$comment": "03 s3.6 / TA-20 REPORT s3: A* heuristic inflation in percent; 25 measured (0 = exact A*); Pathing.set_heuristic_pct until TA-49"
    },
    "cut_ladder": {
      "type": "object",
      "additionalProperties": false,
      "$comment": "03 s4.3 cut ladder as data (R0 B.11 A-51, A-55): the value each rung applies when listed in sim_budget_profile or activated by set_budget_profile. Rung 7 (native twins) is code and has no field.",
      "properties": {
        "rung_1_think_period_ticks": {
          "type": "integer",
          "minimum": 10,
          "maximum": 30,
          "$comment": "autopilot think cadence 10 -> 15 ticks (default on)"
        },
        "rung_2_vision_hz": {
          "type": "integer",
          "minimum": 1,
          "maximum": 10,
          "$comment": "vision 10 -> 5 Hz (default on)"
        },
        "rung_3_projectile_cap": {
          "type": "integer",
          "minimum": 100,
          "maximum": 4000,
          "$comment": "live projectile cap 2,000 -> 1,400 (weapons refuse to fire when full, towers first)"
        },
        "rung_4_ship_pairs_tier_a_only": {
          "type": "boolean",
          "$comment": "ship-ship collision only within tier A sets + towers"
        },
        "rung_5_tier_b_hz": {
          "type": "integer",
          "minimum": 1,
          "maximum": 30,
          "$comment": "tier B snapshot rate 15 -> 10 Hz (04 s4.1; net reads it)"
        },
        "rung_6_unit_cap": {
          "type": "integer",
          "minimum": 1,
          "maximum": 200,
          "$comment": "unit cap 80 -> 60 per player (overrides match_rules.caps.<profile>.units while active)"
        },
        "rung_8_path_expansions_per_tick": {
          "type": "integer",
          "minimum": 30,
          "maximum": 10000,
          "$comment": "path_expansions_per_tick 120 -> 60 (TA-20 REPORT s5 rung 3: 3b p95 halves, 15 km worst ~74 ticks)"
        }
      },
      "required": [
        "rung_1_think_period_ticks",
        "rung_2_vision_hz",
        "rung_3_projectile_cap",
        "rung_4_ship_pairs_tier_a_only",
        "rung_5_tier_b_hz",
        "rung_6_unit_cap",
        "rung_8_path_expansions_per_tick"
      ]
    }
  },
  "required": [
    "ceiling_hard_m",
    "ceiling_soft_m",
    "command_burst",
    "command_rate_per_s",
    "cut_ladder",
    "debug_commands",
    "friendly_fire",
    "gravity",
    "lift_model",
    "override_echo_s",
    "path_expansions_per_tick",
    "path_heuristic_pct",
    "profile_enabled",
    "request_ttl_s",
    "shooter_grace_ticks",
    "sim_budget_profile",
    "tick_hz",
    "uplink_margin_m"
  ],
  "$defs": {
    "id": {
      "type": "string",
      "pattern": "^[a-z][a-z0-9_]*$",
      "$comment": "lowercase snake_case, loads as StringName (R0 B)"
    },
    "status": {
      "enum": [
        "core",
        "candidate"
      ]
    },
    "tags": {
      "type": "array",
      "items": {
        "type": "string",
        "pattern": "^[a-z][a-z0-9_]*$"
      },
      "uniqueItems": true
    },
    "doc": {
      "type": "string",
      "$comment": "hash-excluded one-line rationale (ADR-09, 03 s9.4)"
    },
    "presentation": {
      "type": "object",
      "$comment": "07-owned; stripped from the content hash (03 s9.2). Keys: R0 B.1 ship block + 03 s15.3 PresentationDef + 02 s7 icon.",
      "additionalProperties": false,
      "properties": {
        "mesh": {
          "type": "string"
        },
        "far_mesh_node": {
          "type": "string"
        },
        "vfx": {
          "type": "array",
          "items": {
            "type": "string"
          }
        },
        "sfx": {
          "type": "object"
        },
        "smoke_hp01": {
          "type": "array",
          "items": {
            "type": "number",
            "minimum": 0.0,
            "maximum": 1.0
          },
          "minItems": 3,
          "maxItems": 3
        },
        "camera": {
          "type": "object",
          "additionalProperties": false,
          "properties": {
            "chase_distance_m": {
              "type": "number",
              "minimum": 1,
              "maximum": 500
            }
          }
        },
        "budget_tris": {
          "type": "integer",
          "minimum": 0,
          "maximum": 200000
        },
        "pool": {
          "type": "integer",
          "minimum": 0,
          "maximum": 4096
        },
        "icon": {
          "type": "string"
        }
      }
    }
  }
}
